USB 72 URB_CONTROL out  26942d08801da676 
USB 72 URB_CONTROL out  269015087cfda676 
USB 72 URB_CONTROL in   268f850884fdb6c6
USB 72 URB_CONTROL out  269045087c4da676 
USB 72 URB_CONTROL in   26bf85087c4ec67e
USB 72 URB_CONTROL out  26bfc508844ec67e 
USB 72 URB_CONTROL in   268f8508844d1756
USB 72 URB_CONTROL out  2694bd087895a676 
USB 72 URB_CONTROL out  2695f5088095a636 
USB 96 URB_INTERRUPT out aaaaaabbbbbbff00000000ff000000000000000000000000…  
USB 72 URB_CONTROL out  26c3cd08784ec67e 
USB 72 URB_CONTROL out  26932d08804d1756 
USB 72 URB_CONTROL out  26946d0880fdb6c6 
USB 72 URB_CONTROL out  26949508589da6b6 
USB 96 URB_INTERRUPT out 010101018080808000000000000000000000000000000000…  
USB 72 URB_CONTROL out  2690dd0880adaa76 
USB 96 URB_INTERRUPT out 000000000000000000000000000000000000000000000000…  
USB 96 URB_INTERRUPT out 000000000000000000000000000000000000000000000000…  
USB 96 URB_INTERRUPT out 000000000000000000000000000000000000000000000000…  
USB 96 URB_INTERRUPT out 000000000000000000000000000000000000000000000000…  
USB 72 URB_CONTROL out  2690d50868adaa76 
USB 96 URB_INTERRUPT out 000000000000000000000000000000000000000000000000…  
USB 96 URB_INTERRUPT out 000000000000000000000000000000000000000000000000…  
USB 96 URB_INTERRUPT out 000000000000000000000000000000000000000000000000…  
USB 96 URB_INTERRUPT out 000000000000000000000000000000000000000000000000…  
USB 72 URB_CONTROL out  2690cd0870adaa76 
USB 96 URB_INTERRUPT out 000000000000000000000000000000000000000000000000…  
USB 96 URB_INTERRUPT out 000000000000000000000000000000000000000000000000…  
USB 96 URB_INTERRUPT out 000000000000000000000000000000000000000000000000…  
USB 96 URB_INTERRUPT out 000000000000000000000000000000000000000000000000…  
USB 72 URB_CONTROL out  2690c50858adaa76 
USB 96 URB_INTERRUPT out 000000000000000000000000000000000000000000000000…  
USB 96 URB_INTERRUPT out 000000000000000000000000000000000000000000000000…  
USB 96 URB_INTERRUPT out 000000000000000000000000000000000000000000000000…  
USB 96 URB_INTERRUPT out 000000000000000000000000000000000000000000000000…  
USB 72 URB_CONTROL out  26907d0860adaa76 
USB 96 URB_INTERRUPT out 000000000000000000000000000000000000000000000000…  
USB 96 URB_INTERRUPT out 000000000000000000000000000000000000000000000000…  
USB 96 URB_INTERRUPT out 000000000000000000000000000000000000000000000000…  
USB 96 URB_INTERRUPT out 000000000000000000000000000000000000000000000000…  
USB 72 URB_CONTROL out  2690750848adaa76 
USB 96 URB_INTERRUPT out 000000000000000000000000000000000000000000000000…  
USB 96 URB_INTERRUPT out 000000000000000000000000000000000000000000000000…  
USB 96 URB_INTERRUPT out 000000000000000000000000000000000000000000000000…  
USB 96 URB_INTERRUPT out 000000000000000000000000000000000000000000000000…  
USB 72 URB_CONTROL out  26906d0850adaa76 
USB 96 URB_INTERRUPT out 000000000000000000000000000000000000000000000000…  
USB 96 URB_INTERRUPT out 000000000000000000000000000000000000000000000000…  
USB 96 URB_INTERRUPT out 000000000000000000000000000000000000000000000000…  
USB 96 URB_INTERRUPT out 000000000000000000000000000000000000000000000000…  
USB 72 URB_CONTROL out  26906508b8adaa76 
USB 96 URB_INTERRUPT out 000000000000000000000000000000000000000000000000…  
USB 96 URB_INTERRUPT out 000000000000000000000000000000000000000000000000…  
USB 96 URB_INTERRUPT out 000000000000000000000000000000000000000000000000…  
USB 96 URB_INTERRUPT out 000000000000000000000000000000000000000000000000…  
USB 72 URB_CONTROL out  26909d08c0adaa76 
USB 96 URB_INTERRUPT out 000000000000000000000000000000000000000000000000…  
USB 96 URB_INTERRUPT out 000000000000000000000000000000000000000000000000…  
USB 96 URB_INTERRUPT out 000000000000000000000000000000000000000000000000…  
USB 96 URB_INTERRUPT out 000000000000000000000000000000000000000000000000…  
USB 72 URB_CONTROL out  26909508a8adaa76 
USB 96 URB_INTERRUPT out 000000000000000000000000000000000000000000000000…  
USB 96 URB_INTERRUPT out 000000000000000000000000000000000000000000000000…  
USB 96 URB_INTERRUPT out 000000000000000000000000000000000000000000000000…  
USB 96 URB_INTERRUPT out 000000000000000000000000000000000000000000000000…  
USB 72 URB_CONTROL out  26908d08b0adaa76 
USB 96 URB_INTERRUPT out 000000000000000000000000000000000000000000000000…  
USB 96 URB_INTERRUPT out 000000000000000000000000000000000000000000000000…  
USB 96 URB_INTERRUPT out 000000000000000000000000000000000000000000000000…  
USB 96 URB_INTERRUPT out 000000000000000000000000000000000000000000000000…  
USB 72 URB_CONTROL out  2690850898adaa76 
USB 96 URB_INTERRUPT out 000000000000000000000000000000000000000000000000…  
USB 96 URB_INTERRUPT out 000000000000000000000000000000000000000000000000…  
USB 96 URB_INTERRUPT out 000000000000000000000000000000000000000000000000…  
USB 96 URB_INTERRUPT out 000000000000000000000000000000000000000000000000…  
USB 72 URB_CONTROL out  2690dd0884ada676 
USB 72 URB_CONTROL in   268f850884adaa76
USB 96 URB_INTERRUPT in 000000000000000000000000000000000000000000000000…  
USB 96 URB_INTERRUPT in 000000000000000000000000000000000000000000000000…  
USB 96 URB_INTERRUPT in 000000000000000000000000000000000000000000000000…  
USB 96 URB_INTERRUPT in 000000000000000000000000000000000000000000000000…  
USB 72 URB_CONTROL out  2690d5086cada676 
USB 72 URB_CONTROL in   268f85086cadaa76
USB 96 URB_INTERRUPT in 000000000000000000000000000000000000000000000000…  
USB 96 URB_INTERRUPT in 000000000000000000000000000000000000000000000000…  
USB 96 URB_INTERRUPT in 000000000000000000000000000000000000000000000000…  
USB 96 URB_INTERRUPT in 000000000000000000000000000000000000000000000000…  
USB 72 URB_CONTROL out  2690cd0874ada676 
USB 72 URB_CONTROL in   268f850874adaa76
USB 96 URB_INTERRUPT in 000000000000000000000000000000000000000000000000…  
USB 96 URB_INTERRUPT in 000000000000000000000000000000000000000000000000…  
USB 96 URB_INTERRUPT in 000000000000000000000000000000000000000000000000…  
USB 96 URB_INTERRUPT in 000000000000000000000000000000000000000000000000…  
USB 72 URB_CONTROL out  2690c5085cada676 
USB 72 URB_CONTROL in   268f85085cadaa76
USB 96 URB_INTERRUPT in 000000000000000000000000000000000000000000000000…  
USB 96 URB_INTERRUPT in 000000000000000000000000000000000000000000000000…  
USB 96 URB_INTERRUPT in 000000000000000000000000000000000000000000000000…  
USB 96 URB_INTERRUPT in 000000000000000000000000000000000000000000000000…  
USB 72 URB_CONTROL out  26907d0864ada676 
USB 72 URB_CONTROL in   268f850864adaa76
USB 96 URB_INTERRUPT in 000000000000000000000000000000000000000000000000…  
USB 96 URB_INTERRUPT in 000000000000000000000000000000000000000000000000…  
USB 96 URB_INTERRUPT in 000000000000000000000000000000000000000000000000…  
USB 96 URB_INTERRUPT in 000000000000000000000000000000000000000000000000…  
USB 72 URB_CONTROL out  269075084cada676 
USB 72 URB_CONTROL in   268f85084cadaa76
USB 96 URB_INTERRUPT in 000000000000000000000000000000000000000000000000…  
USB 96 URB_INTERRUPT in 000000000000000000000000000000000000000000000000…  
USB 96 URB_INTERRUPT in 000000000000000000000000000000000000000000000000…  
USB 96 URB_INTERRUPT in 000000000000000000000000000000000000000000000000…  
USB 72 URB_CONTROL out  26906d0854ada676 
USB 72 URB_CONTROL in   268f850854adaa76
USB 96 URB_INTERRUPT in 000000000000000000000000000000000000000000000000…  
USB 96 URB_INTERRUPT in 000000000000000000000000000000000000000000000000…  
USB 96 URB_INTERRUPT in 000000000000000000000000000000000000000000000000…  
USB 96 URB_INTERRUPT in 000000000000000000000000000000000000000000000000…  
USB 72 URB_CONTROL out  26906508bcada676 
USB 72 URB_CONTROL in   268f8508bcadaa76
USB 96 URB_INTERRUPT in 000000000000000000000000000000000000000000000000…  
USB 96 URB_INTERRUPT in 000000000000000000000000000000000000000000000000…  
USB 96 URB_INTERRUPT in 000000000000000000000000000000000000000000000000…  
USB 96 URB_INTERRUPT in 000000000000000000000000000000000000000000000000…  
USB 72 URB_CONTROL out  26909d08c4ada676 
USB 72 URB_CONTROL in   268f8508c4adaa76
USB 96 URB_INTERRUPT in 000000000000000000000000000000000000000000000000…  
USB 96 URB_INTERRUPT in 000000000000000000000000000000000000000000000000…  
USB 96 URB_INTERRUPT in 000000000000000000000000000000000000000000000000…  
USB 96 URB_INTERRUPT in 000000000000000000000000000000000000000000000000…  
USB 72 URB_CONTROL out  26909508acada676 
USB 72 URB_CONTROL in   268f8508acadaa76
USB 96 URB_INTERRUPT in 000000000000000000000000000000000000000000000000…  
USB 96 URB_INTERRUPT in 000000000000000000000000000000000000000000000000…  
USB 96 URB_INTERRUPT in 000000000000000000000000000000000000000000000000…  
USB 96 URB_INTERRUPT in 000000000000000000000000000000000000000000000000…  
USB 72 URB_CONTROL out  26908d08b4ada676 
USB 72 URB_CONTROL in   268f8508b4adaa76
USB 96 URB_INTERRUPT in 000000000000000000000000000000000000000000000000…  
USB 96 URB_INTERRUPT in 000000000000000000000000000000000000000000000000…  
USB 96 URB_INTERRUPT in 000000000000000000000000000000000000000000000000…  
USB 96 URB_INTERRUPT in 000000000000000000000000000000000000000000000000…  
USB 72 URB_CONTROL out  269085089cada676 
USB 72 URB_CONTROL in   268f85089cadaa76
USB 96 URB_INTERRUPT in 000000000000000000000000000000000000000000000000…  
USB 96 URB_INTERRUPT in 000000000000000000000000000000000000000000000000…  
USB 96 URB_INTERRUPT in 000000000000000000000000000000000000000000000000…  
USB 96 URB_INTERRUPT in 000000000000000000000000000000000000000000000000…  
USB 72 URB_CONTROL out  2692a50880a5a876 
USB 96 URB_INTERRUPT out 0100f0000100f1000100f2000100f4000100f30007000300…  
USB 96 URB_INTERRUPT out 000000000000000000000000000000000000000000000000…  
USB 72 URB_CONTROL out  2692dd0868a5a876 
USB 96 URB_INTERRUPT out 000000000000000000000000000000000000000000000000…  
USB 96 URB_INTERRUPT out 000000000000000000000000000000000000000000000000…  
USB 72 URB_CONTROL out  2692d50870a5a876 
USB 96 URB_INTERRUPT out 0100f0000100f1000100f2000100f4000100f30008000300…  
USB 96 URB_INTERRUPT out 000000000000000000000000000000000000000000000000…  
USB 72 URB_CONTROL out  2692cd0858a5a876 
USB 96 URB_INTERRUPT out 000000000000000000000000000000000000000000000000…  
USB 96 URB_INTERRUPT out 000000000000000000000000000000000000000000000000…  
